{
  "schemaVersion": 1,
  "registryVersion": "0.1.1",
  "compatibility": {
    "svelte": "5.57.3",
    "bits": "2.20.2-svelte-ui-kit.1",
    "date": "^3.8.1"
  },
  "items": [
    {
      "id": "alert",
      "manifest": "ui/alert.json"
    },
    {
      "id": "alert-dialog",
      "manifest": "ui/alert-dialog.json"
    },
    {
      "id": "anchor",
      "manifest": "ui/anchor.json"
    },
    {
      "id": "avatar",
      "manifest": "ui/avatar.json"
    },
    {
      "id": "badge",
      "manifest": "ui/badge.json"
    },
    {
      "id": "button",
      "manifest": "ui/button.json"
    },
    {
      "id": "card",
      "manifest": "ui/card.json"
    },
    {
      "id": "checkbox",
      "manifest": "ui/checkbox.json"
    },
    {
      "id": "collapsible",
      "manifest": "ui/collapsible.json"
    },
    {
      "id": "dialog",
      "manifest": "ui/dialog.json"
    },
    {
      "id": "field",
      "manifest": "ui/field.json"
    },
    {
      "id": "menu",
      "manifest": "ui/menu.json"
    },
    {
      "id": "progress",
      "manifest": "ui/progress.json"
    },
    {
      "id": "radio",
      "manifest": "ui/radio.json"
    },
    {
      "id": "router-link",
      "manifest": "ui/router-link.json"
    },
    {
      "id": "separator",
      "manifest": "ui/separator.json"
    },
    {
      "id": "skeleton",
      "manifest": "ui/skeleton.json"
    },
    {
      "id": "spinner",
      "manifest": "ui/spinner.json"
    },
    {
      "id": "status",
      "manifest": "ui/status.json"
    },
    {
      "id": "switch",
      "manifest": "ui/switch.json"
    },
    {
      "id": "tabs",
      "manifest": "ui/tabs.json"
    },
    {
      "id": "tokens",
      "manifest": "foundation/tokens.json"
    }
  ],
  "contentHash": "25b7ea1cb44e904db8613422d35cbfc0c301463ac2fe4b6c61c3d09806e4e904"
}
